	source_file	hard_to_understand_sentence	hard_to_understand_begin	hard_to_understand_end	annotator	hard_to_understand__annotation	hard_to_understand_span	hard_to_understand__sentence_text	hard_to_understand_reason
0	075398ee-9f9f-4ff7-97aa-7d0315844130.txt	075398ee-9f9f-4ff7-97aa-7d0315844130.txt_1272-2027	1281	1499	rachneet	w.c.Hardtounderstand(Reasonfordifficulty=This part is linguistically weak and confuses the reader., begin=1281, end=1499)	"A ""muscle knotting up"" is called a ""tetanic contraction"", which means the muscle contracted by a constant stream if nerve impulses telling it to do so. the causes can vary from phycological to chemical to pathological."	"ANSWER2:
A ""muscle knotting up"" is called a ""tetanic contraction"", which means the muscle contracted by a constant stream if nerve impulses telling it to do so. the causes can vary from phycological to chemical to pathological. psychological reasons usually involve stresses and panic. the most common chemical reason it happens is because of a buildup of lactic acid inside of the muscle tissue. the act of contracting a muscle is mostly a chemical reaction started by a nerve impulse to where the muscle tissue uses glucose, then releases lactic acid into the blood to be carried away and (hopefully) neutralized. if your blood flow cannot move it away fast enough, the lactic acid builds up in the muscle tissue and makes the nerve impulses go haywire."	This part is linguistically weak and confuses the reader.
1	00f64ae1-c96a-4b2e-9912-c40e295e2565.txt	00f64ae1-c96a-4b2e-9912-c40e295e2565.txt_665-990	674	791	rachneet	w.c.Hardtounderstand(Reasonfordifficulty=The sentence is not well written and has grammatical issues., begin=674, end=791)	"One of the early things your immune system does as it's developing is to ""learn"" what things it encounters are *you*."	"ANSWER2:
One of the early things your immune system does as it's developing is to ""learn"" what things it encounters are *you*. unfortunately, this isn't perfect, either from the very beginning or later in life, and it'll occasionally fail to delete immune cells that target particular proteins and the like on your own cells."	The sentence is not well written and has grammatical issues.
2	02062ffd-f0bb-4566-847c-fc7057d4ce0b.txt	02062ffd-f0bb-4566-847c-fc7057d4ce0b.txt_490-573	514	516	rachneet	w.c.Hardtounderstand(Reasonfordifficulty=short-form grammar used which may not be clear to everyone., begin=514, end=516)	bc	you’re more aware of it bc the pain signals have your attention drawn to that spot.	short-form grammar used which may not be clear to everyone.
